question,category,sub_category
"I want to cancel my admission, withdraw from the program, or defer to a later batch. What is the process, and what happens to my fees or EMIs?",program-related-query,program-withdrawal-and-refund
"When and how will I receive my course completion certificate, degree, or digital certificate, and will a hard copy or transcript be provided?",program-related-query,result-and-certificate
"How can I view my current marks, grades, or CGPA for quizzes, assignments, modules, and overall program performance on the portal?",program-related-query,results-access
"I am a working professional or have other academic commitments and my class timings clash with my schedule. What options do I have (recordings, batch change, reschedule)?",program-related-query,schedule-conflict-support
I have not received a response or resolution to a previously raised query or ticket. How can I escalate or follow up?,program-related-query,support-escalation
"Where can I find the complete course syllabus, module-wise curriculum, and agenda, including which topics will be covered and when?",program-related-query,syllabus
"How can I get a detailed timetable or weekly schedule for upcoming classes, including faculty, topics, and session types?",program-related-query,timetable-and-schedule
"How can I get or use my referral link to refer friends, and how do I track the status and rewards of my referrals?",referrals,referral-link
"What items or study materials (books, PDFs, notes) are provided as part of the course, and where can I access or download them?",student-kit,course-materials
"I have not received my ID card, admission letter, or they contain incorrect details. How can I get them issued or corrected?",student-kit,id-card
"How do I fill, submit, or correct mandatory onboarding or student kit forms on the LMS if I missed the deadline or faced technical issues?",student-kit,onboarding-form
"When will I receive my student kit or welcome kit, what items are included, and how can I track its delivery status or resolve missing or damaged items?",student-kit,student-kit
"How can I update or correct my address, T-shirt size, or personal details (name, email, photo) used for my student kit, ID card, and certificate delivery?",student-kit,student-kit-address
"My student kit tracking link or ID shows errors like 'details not found' or 'article not booked', or the shipment is delayed or returned. How can I get accurate tracking or a re-dispatch?",student-kit,student-kit-tracking
